{
  "schema_version": "1.0",
  "campaign_id": "C2026Q1_stage1_refresh",
  "run_id": "RUN_20260312T115832Z",
  "run_timestamp": "2026-03-12T11:58:32.803901+00:00",
  "manifest_ref": "_coord\\campaigns\\C2026Q1_stage1_refresh\\manifest.yaml",
  "pack_id": "triple_sigma_pack_step15_q1",
  "pack_dir": "C:\\Users\\awdse\\AppData\\Roaming\\MetaQuotes\\Terminal\\D0E8209F77C8CF37AD8BF550E51FF075\\MQL5\\Files\\triple_sigma_pack_step15_q1",
  "preset_snapshot": "00_request/preset_snapshot.ini",
  "window_alias": "benchmark",
  "window_from": "2024.06.04 17:25",
  "window_to": "2025.04.02 09:00",
  "compile_result": {
    "errors": 0,
    "warnings": 0,
    "log_path": "10_compile/compile_log.txt"
  },
  "raw_outputs": {
    "trade_log": "20_raw/trade_log.csv",
    "bar_logs": [
      "20_raw/bar_log_20240603.csv",
      "20_raw/bar_log_20240604.csv",
      "20_raw/bar_log_20240605.csv",
      "20_raw/bar_log_20240606.csv",
      "20_raw/bar_log_20240607.csv",
      "20_raw/bar_log_20240610.csv",
      "20_raw/bar_log_20240611.csv",
      "20_raw/bar_log_20240612.csv",
      "20_raw/bar_log_20240613.csv",
      "20_raw/bar_log_20240614.csv",
      "20_raw/bar_log_20240617.csv",
      "20_raw/bar_log_20240618.csv",
      "20_raw/bar_log_20240619.csv",
      "20_raw/bar_log_20240620.csv",
      "20_raw/bar_log_20240621.csv",
      "20_raw/bar_log_20240624.csv",
      "20_raw/bar_log_20240625.csv",
      "20_raw/bar_log_20240626.csv",
      "20_raw/bar_log_20240627.csv",
      "20_raw/bar_log_20240628.csv",
      "20_raw/bar_log_20240701.csv",
      "20_raw/bar_log_20240702.csv",
      "20_raw/bar_log_20240703.csv",
      "20_raw/bar_log_20240704.csv",
      "20_raw/bar_log_20240705.csv",
      "20_raw/bar_log_20240708.csv",
      "20_raw/bar_log_20240709.csv",
      "20_raw/bar_log_20240710.csv",
      "20_raw/bar_log_20240711.csv",
      "20_raw/bar_log_20240712.csv",
      "20_raw/bar_log_20240715.csv",
      "20_raw/bar_log_20240716.csv",
      "20_raw/bar_log_20240717.csv",
      "20_raw/bar_log_20240718.csv",
      "20_raw/bar_log_20240719.csv",
      "20_raw/bar_log_20240722.csv",
      "20_raw/bar_log_20240723.csv",
      "20_raw/bar_log_20240724.csv",
      "20_raw/bar_log_20240725.csv",
      "20_raw/bar_log_20240726.csv",
      "20_raw/bar_log_20240729.csv",
      "20_raw/bar_log_20240730.csv",
      "20_raw/bar_log_20240731.csv",
      "20_raw/bar_log_20240801.csv",
      "20_raw/bar_log_20240802.csv",
      "20_raw/bar_log_20240805.csv",
      "20_raw/bar_log_20240806.csv",
      "20_raw/bar_log_20240807.csv",
      "20_raw/bar_log_20240808.csv",
      "20_raw/bar_log_20240809.csv",
      "20_raw/bar_log_20240812.csv",
      "20_raw/bar_log_20240813.csv",
      "20_raw/bar_log_20240814.csv",
      "20_raw/bar_log_20240815.csv",
      "20_raw/bar_log_20240816.csv",
      "20_raw/bar_log_20240819.csv",
      "20_raw/bar_log_20240820.csv",
      "20_raw/bar_log_20240821.csv",
      "20_raw/bar_log_20240822.csv",
      "20_raw/bar_log_20240823.csv",
      "20_raw/bar_log_20240826.csv",
      "20_raw/bar_log_20240827.csv",
      "20_raw/bar_log_20240828.csv",
      "20_raw/bar_log_20240829.csv",
      "20_raw/bar_log_20240830.csv",
      "20_raw/bar_log_20240902.csv",
      "20_raw/bar_log_20240903.csv",
      "20_raw/bar_log_20240904.csv",
      "20_raw/bar_log_20240905.csv",
      "20_raw/bar_log_20240906.csv",
      "20_raw/bar_log_20240909.csv",
      "20_raw/bar_log_20240910.csv",
      "20_raw/bar_log_20240911.csv",
      "20_raw/bar_log_20240912.csv",
      "20_raw/bar_log_20240913.csv",
      "20_raw/bar_log_20240916.csv",
      "20_raw/bar_log_20240917.csv",
      "20_raw/bar_log_20240918.csv",
      "20_raw/bar_log_20240919.csv",
      "20_raw/bar_log_20240920.csv",
      "20_raw/bar_log_20240923.csv",
      "20_raw/bar_log_20240924.csv",
      "20_raw/bar_log_20240925.csv",
      "20_raw/bar_log_20240926.csv",
      "20_raw/bar_log_20240927.csv",
      "20_raw/bar_log_20240930.csv",
      "20_raw/bar_log_20241001.csv",
      "20_raw/bar_log_20241002.csv",
      "20_raw/bar_log_20241003.csv",
      "20_raw/bar_log_20241004.csv",
      "20_raw/bar_log_20241007.csv",
      "20_raw/bar_log_20241008.csv",
      "20_raw/bar_log_20241009.csv",
      "20_raw/bar_log_20241010.csv",
      "20_raw/bar_log_20241011.csv",
      "20_raw/bar_log_20241014.csv",
      "20_raw/bar_log_20241015.csv",
      "20_raw/bar_log_20241016.csv",
      "20_raw/bar_log_20241017.csv",
      "20_raw/bar_log_20241018.csv",
      "20_raw/bar_log_20241021.csv",
      "20_raw/bar_log_20241022.csv",
      "20_raw/bar_log_20241023.csv",
      "20_raw/bar_log_20241024.csv",
      "20_raw/bar_log_20241025.csv",
      "20_raw/bar_log_20241028.csv",
      "20_raw/bar_log_20241029.csv",
      "20_raw/bar_log_20241030.csv",
      "20_raw/bar_log_20241031.csv",
      "20_raw/bar_log_20241101.csv",
      "20_raw/bar_log_20241104.csv",
      "20_raw/bar_log_20241105.csv",
      "20_raw/bar_log_20241106.csv",
      "20_raw/bar_log_20241107.csv",
      "20_raw/bar_log_20241108.csv",
      "20_raw/bar_log_20241111.csv",
      "20_raw/bar_log_20241112.csv",
      "20_raw/bar_log_20241113.csv",
      "20_raw/bar_log_20241114.csv",
      "20_raw/bar_log_20241115.csv",
      "20_raw/bar_log_20241118.csv",
      "20_raw/bar_log_20241119.csv",
      "20_raw/bar_log_20241120.csv",
      "20_raw/bar_log_20241121.csv",
      "20_raw/bar_log_20241122.csv",
      "20_raw/bar_log_20241125.csv",
      "20_raw/bar_log_20241126.csv",
      "20_raw/bar_log_20241127.csv",
      "20_raw/bar_log_20241128.csv",
      "20_raw/bar_log_20241129.csv",
      "20_raw/bar_log_20241202.csv",
      "20_raw/bar_log_20241203.csv",
      "20_raw/bar_log_20241204.csv",
      "20_raw/bar_log_20241205.csv",
      "20_raw/bar_log_20241206.csv",
      "20_raw/bar_log_20241209.csv",
      "20_raw/bar_log_20241210.csv",
      "20_raw/bar_log_20241211.csv",
      "20_raw/bar_log_20241212.csv",
      "20_raw/bar_log_20241213.csv",
      "20_raw/bar_log_20241216.csv",
      "20_raw/bar_log_20241217.csv",
      "20_raw/bar_log_20241218.csv",
      "20_raw/bar_log_20241219.csv",
      "20_raw/bar_log_20241220.csv",
      "20_raw/bar_log_20241223.csv",
      "20_raw/bar_log_20241224.csv",
      "20_raw/bar_log_20241226.csv",
      "20_raw/bar_log_20241227.csv",
      "20_raw/bar_log_20241230.csv",
      "20_raw/bar_log_20241231.csv",
      "20_raw/bar_log_20250102.csv",
      "20_raw/bar_log_20250103.csv",
      "20_raw/bar_log_20250106.csv",
      "20_raw/bar_log_20250107.csv",
      "20_raw/bar_log_20250108.csv",
      "20_raw/bar_log_20250109.csv",
      "20_raw/bar_log_20250110.csv",
      "20_raw/bar_log_20250113.csv",
      "20_raw/bar_log_20250114.csv",
      "20_raw/bar_log_20250115.csv",
      "20_raw/bar_log_20250116.csv",
      "20_raw/bar_log_20250117.csv",
      "20_raw/bar_log_20250120.csv",
      "20_raw/bar_log_20250121.csv",
      "20_raw/bar_log_20250122.csv",
      "20_raw/bar_log_20250123.csv",
      "20_raw/bar_log_20250124.csv",
      "20_raw/bar_log_20250127.csv",
      "20_raw/bar_log_20250128.csv",
      "20_raw/bar_log_20250129.csv",
      "20_raw/bar_log_20250130.csv",
      "20_raw/bar_log_20250131.csv",
      "20_raw/bar_log_20250203.csv",
      "20_raw/bar_log_20250204.csv",
      "20_raw/bar_log_20250205.csv",
      "20_raw/bar_log_20250206.csv",
      "20_raw/bar_log_20250207.csv",
      "20_raw/bar_log_20250210.csv",
      "20_raw/bar_log_20250211.csv",
      "20_raw/bar_log_20250212.csv",
      "20_raw/bar_log_20250213.csv",
      "20_raw/bar_log_20250214.csv",
      "20_raw/bar_log_20250217.csv",
      "20_raw/bar_log_20250218.csv",
      "20_raw/bar_log_20250219.csv",
      "20_raw/bar_log_20250220.csv",
      "20_raw/bar_log_20250221.csv",
      "20_raw/bar_log_20250224.csv",
      "20_raw/bar_log_20250225.csv",
      "20_raw/bar_log_20250226.csv",
      "20_raw/bar_log_20250227.csv",
      "20_raw/bar_log_20250228.csv",
      "20_raw/bar_log_20250303.csv",
      "20_raw/bar_log_20250304.csv",
      "20_raw/bar_log_20250305.csv",
      "20_raw/bar_log_20250306.csv",
      "20_raw/bar_log_20250307.csv",
      "20_raw/bar_log_20250310.csv",
      "20_raw/bar_log_20250311.csv",
      "20_raw/bar_log_20250312.csv",
      "20_raw/bar_log_20250313.csv",
      "20_raw/bar_log_20250314.csv",
      "20_raw/bar_log_20250317.csv",
      "20_raw/bar_log_20250318.csv",
      "20_raw/bar_log_20250319.csv",
      "20_raw/bar_log_20250320.csv",
      "20_raw/bar_log_20250321.csv",
      "20_raw/bar_log_20250324.csv",
      "20_raw/bar_log_20250325.csv",
      "20_raw/bar_log_20250326.csv",
      "20_raw/bar_log_20250327.csv",
      "20_raw/bar_log_20250328.csv",
      "20_raw/bar_log_20250331.csv",
      "20_raw/bar_log_20250401.csv"
    ],
    "exec_state": "20_raw/exec_state.ini"
  },
  "hash_manifests": {
    "raw_hash_ref": "21_hash/raw_hash_manifest.json",
    "pack_hash_ref": "21_hash/pack_hash_manifest.json"
  },
  "status": "complete"
}